{"assurances":{"injected_markers_preserved":true,"network_request_performed":false,"private_or_live_capability_used":false,"production_preflight_functions_exercised":true,"target_mutation_observed":false,"temporary_fixture_removed":true},"bindings":{"implementation_identity":"git:5ba281181e9c92da1aa30cd85dd520e888e11498"},"cases":[{"boundary":"canonical-candle-publication","case_id":"canonical-candle-publication-building","detected":true,"error_class":"PublicationError","marker_kind":"building-directory-marker","marker_preserved":true,"target_mutated":false},{"boundary":"canonical-funding-publication","case_id":"canonical-funding-publication-building","detected":true,"error_class":"PublicationError","marker_kind":"building-directory-marker","marker_preserved":true,"target_mutated":false},{"boundary":"canonical-candle-compaction","case_id":"canonical-candle-compaction-building","detected":true,"error_class":"PublicationError","marker_kind":"building-directory-marker","marker_preserved":true,"target_mutated":false},{"boundary":"canonical-catalog-registration","case_id":"catalog-registration-building","detected":true,"error_class":"CatalogError","marker_kind":"catalog-building-file","marker_preserved":true,"target_mutated":false},{"boundary":"canonical-catalog-registration","case_id":"catalog-registration-lock","detected":true,"error_class":"CatalogError","marker_kind":"catalog-write-lock","marker_preserved":true,"target_mutated":false}],"content_sha256":"8931046401916b97f342e0404a5ce98faf859e63b9a9eb6b21307e322f1685d3","evidence_schema":"grid.phase2-stale-output-fault-injection/v1","generated_at_utc":"2026-08-14T01:10:28.022275Z","measurement":{"case_count":5,"detected_count":5,"marker_preserved_count":5,"target_mutation_count":0},"scope":{"canonical_candle_compaction":true,"canonical_candle_publication":true,"canonical_catalog_registration":true,"canonical_funding_publication":true},"status":"verified-stale-output-fault-injection","storage_policy":{"evidence_contains_account_data":false,"evidence_contains_market_values":false,"evidence_contains_runtime_paths":false,"runtime_fixture_committed_to_git":false}}
